{
  "$schema": "https://json-schema.org/draft/2020-12/schema",
  "title": "ARMILAR official engine v0.9.6 policy",
  "type": "object",
  "additionalProperties": false,
  "required": [
    "policy_id",
    "policy_version",
    "constitution_id",
    "constitution_version",
    "constitution_sha256",
    "ratification_record_sha256",
    "reference_year",
    "reference_average",
    "categories",
    "start_period",
    "end_period",
    "precision",
    "rounding",
    "fixed_weight_column",
    "release_gates",
    "ooh_sensitivity_required"
  ],
  "properties": {
    "policy_id": {"const": "ARMILAR_OFFICIAL_ENGINE_V096"},
    "policy_version": {"const": "0.9.6"},
    "constitution_id": {"const": "ARMILAR_RESEARCH_CORE_V1"},
    "constitution_version": {"const": "1.0.0-research"},
    "constitution_sha256": {"const": "5d0b6eb1a0f8111c3d8c3d5a8d8f70ed05789a9de82c1d68dab4233ea3f135e6"},
    "ratification_record_sha256": {"const": "365dbf0fe8d42996d805c3961dab90fb2bc8f26935bff5b4c775592f9177d561"},
    "reference_year": {"const": 2021},
    "reference_average": {"const": "100"},
    "categories": {
      "const": ["CP01", "CP02", "CP03", "CP04", "CP05", "CP06", "CP07", "CP08", "CP09", "CP10", "CP11", "CP12"]
    },
    "start_period": {"const": "2021-01"},
    "end_period": {"const": "2025-12"},
    "precision": {"const": 28},
    "rounding": {"const": "ROUND_HALF_EVEN"},
    "fixed_weight_column": {"const": "fixed_universe_weight"},
    "release_gates": {
      "type": "object",
      "additionalProperties": false,
      "required": [
        "research_release_allowed",
        "model_promotion_allowed",
        "shadow_production_allowed",
        "monetary_release_allowed",
        "world_claim_allowed"
      ],
      "properties": {
        "research_release_allowed": {"const": false},
        "model_promotion_allowed": {"const": false},
        "shadow_production_allowed": {"const": false},
        "monetary_release_allowed": {"const": false},
        "world_claim_allowed": {"const": false}
      }
    },
    "ooh_sensitivity_required": {"const": true}
  }
}
